{
  "$schema": "https://json-schema.org/draft/2020-12/schema",
  "$id": "https://nextx.local/schemas/triage-input.v1.json",
  "title": "NextX Quick Triage Input v1",
  "type": "object",
  "additionalProperties": false,
  "required": [
    "schema_version", "account_key", "signal_id", "display_title", "language",
    "content_lane", "topic_labels", "triage_status", "recommended_action",
    "triage_factors", "triage_confidence", "summary", "target_reader",
    "why_relevant", "value_add", "risk", "deep_dive", "reason_codes"
  ],
  "properties": {
    "schema_version": {"const": 1},
    "account_key": {"const": "primary"},
    "signal_id": {"type": "string", "minLength": 1, "maxLength": 256},
    "display_title": {"type": "string", "minLength": 1, "maxLength": 100},
    "language": {"type": "string", "minLength": 1, "maxLength": 32},
    "content_lane": {"enum": ["builder_core", "ai_productivity", "ai_content", "adjacent_exploration"]},
    "topic_labels": {"type": "array", "minItems": 1, "maxItems": 5, "uniqueItems": true, "items": {"type": "string", "minLength": 1, "maxLength": 64}},
    "topic_cluster_id": {"type": ["string", "null"], "maxLength": 128},
    "triage_status": {"enum": ["ready", "needs_review", "filtered"]},
    "recommended_action": {"enum": ["reply", "quote", "topic", "deep_dive", "reserve", "archive"]},
    "triage_factors": {
      "type": "object",
      "additionalProperties": false,
      "required": ["reader_fit", "evidence", "value_add", "urgency"],
      "properties": {
        "reader_fit": {"type": "integer", "minimum": 0, "maximum": 5},
        "evidence": {"type": "integer", "minimum": 0, "maximum": 5},
        "value_add": {"type": "integer", "minimum": 0, "maximum": 5},
        "urgency": {"type": "integer", "minimum": 0, "maximum": 5}
      }
    },
    "triage_confidence": {"enum": ["high", "medium", "low"]},
    "summary": {"type": "string", "minLength": 1, "maxLength": 500},
    "target_reader": {"type": "string", "minLength": 1, "maxLength": 300},
    "why_relevant": {"type": "string", "minLength": 1, "maxLength": 500},
    "value_add": {"type": "string", "minLength": 1, "maxLength": 500},
    "risk": {"type": "string", "minLength": 1, "maxLength": 300},
    "deep_dive": {"type": "boolean"},
    "reason_codes": {"type": "array", "maxItems": 5, "uniqueItems": true, "items": {"type": "string", "minLength": 1, "maxLength": 64}}
  }
}
